{
  "artifact_count": 18,
  "artifact_type": "RELEASE_FREEZE_MANIFEST",
  "artifacts": [
    {
      "artifact_id": "DEMO_BUNDLE",
      "bytes": 2268,
      "final_checker_role": "FINAL_REVIEWER",
      "kind": "JSON",
      "path": "cases/n31/demo_bundle/bundle.json",
      "release_channels": [
        "CODE_REPOSITORY",
        "DEMO_RUNTIME"
      ],
      "responsible_role": "TECHNICAL_OWNER",
      "sha256": "6fb8a9608b983de64374ce14128b3c03b20bf6fe07074837da36439daf94c92b",
      "status": "FROZEN_MACHINE_VERIFIED"
    },
    {
      "artifact_id": "GOLD_SOP",
      "bytes": 99953,
      "final_checker_role": "FINAL_REVIEWER",
      "kind": "JSON",
      "path": "cases/n31/gold/gold_sop.json",
      "release_channels": [
        "CODE_REPOSITORY",
        "DEMO_RUNTIME"
      ],
      "responsible_role": "EVIDENCE_OWNER",
      "sha256": "a8f111a52f496f93e9934cedd493630d73732ad73e6e4e79832f0133c31c6f8a",
      "status": "FROZEN_MACHINE_VERIFIED"
    },
    {
      "artifact_id": "SOP_VIEWS",
      "bytes": 90630,
      "final_checker_role": "EVIDENCE_OWNER",
      "kind": "JSON",
      "path": "cases/n31/demo_bundle/sop_views.json",
      "release_channels": [
        "CODE_REPOSITORY",
        "DEMO_RUNTIME"
      ],
      "responsible_role": "CONTENT_OWNER",
      "sha256": "7c18ecbf1be02bbfd91cd245335343b515fcedf3261e8571263a698ae0036397",
      "status": "FROZEN_MACHINE_VERIFIED"
    },
    {
      "artifact_id": "MULTISOURCE_EVAL",
      "bytes": 3859,
      "final_checker_role": "TECHNICAL_OWNER",
      "kind": "JSON",
      "path": "cases/n31/evaluations/multisource_comparison_v1.json",
      "release_channels": [
        "CODE_REPOSITORY"
      ],
      "responsible_role": "EVIDENCE_OWNER",
      "sha256": "f0adc9b6dbfd1f34d1e3e57ec3588d60b96562bea5b6b167fd05408040aac7af",
      "status": "FROZEN_MACHINE_VERIFIED"
    },
    {
      "artifact_id": "DGX_VISUAL",
      "bytes": 17979,
      "final_checker_role": "EVIDENCE_OWNER",
      "kind": "JSON",
      "path": "cases/n31/evaluations/dgx_visual_compute_v1.json",
      "release_channels": [
        "CODE_REPOSITORY"
      ],
      "responsible_role": "TECHNICAL_OWNER",
      "sha256": "b475c03d34b4a5db8c423b97f72fdfc11d1d5e99e28c699ed2cac6fc912ab9fb",
      "status": "FROZEN_MACHINE_VERIFIED"
    },
    {
      "artifact_id": "TEMPORAL_WINDOWS",
      "bytes": 12958,
      "final_checker_role": "TECHNICAL_OWNER",
      "kind": "JSON",
      "path": "cases/n31/evaluations/temporal_action_windows_v1.json",
      "release_channels": [
        "CODE_REPOSITORY"
      ],
      "responsible_role": "EVIDENCE_OWNER",
      "sha256": "d1025f1337517194fbd245be9d005cd74986792348a9a1b797008a80f3694847",
      "status": "FROZEN_MACHINE_VERIFIED"
    },
    {
      "artifact_id": "PDF_STRUCTURE",
      "bytes": 5948,
      "final_checker_role": "TECHNICAL_OWNER",
      "kind": "JSON",
      "path": "cases/n31/evaluations/pdf_structure_v1.json",
      "release_channels": [
        "CODE_REPOSITORY"
      ],
      "responsible_role": "EVIDENCE_OWNER",
      "sha256": "0e40aea7fbdc3440a4c99e97e2a3db2e37f02b6e6a930445808ab2aee850aa97",
      "status": "FROZEN_MACHINE_VERIFIED"
    },
    {
      "artifact_id": "SOURCE_CANDIDATES",
      "bytes": 68264,
      "final_checker_role": "FINAL_REVIEWER",
      "kind": "JSON",
      "path": "cases/n31/evaluations/source_candidate_synthesis_v1.json",
      "release_channels": [
        "CODE_REPOSITORY"
      ],
      "responsible_role": "EVIDENCE_OWNER",
      "sha256": "28708602befa289bb6a8ce97436b43384a2569a3de79c1b104011815d3c68ec3",
      "status": "FROZEN_MACHINE_VERIFIED"
    },
    {
      "artifact_id": "GROUNDING_GATE",
      "bytes": 5821,
      "final_checker_role": "FINAL_REVIEWER",
      "kind": "JSON",
      "path": "cases/n31/evaluations/deterministic_grounding_gate_v1.json",
      "release_channels": [
        "CODE_REPOSITORY"
      ],
      "responsible_role": "EVIDENCE_OWNER",
      "sha256": "469a6c83f1fa22cb1616a8a12f5aee36fc61813350028d3e77abd430621ab1c1",
      "status": "FROZEN_MACHINE_VERIFIED"
    },
    {
      "artifact_id": "SEMANTIC_REVIEW",
      "bytes": 11170,
      "final_checker_role": "FINAL_REVIEWER",
      "kind": "JSON",
      "path": "cases/n31/evaluations/semantic_review_v1.json",
      "release_channels": [
        "CODE_REPOSITORY"
      ],
      "responsible_role": "EVIDENCE_OWNER",
      "sha256": "7cc4676d14bc12aec676e7f34ec126edc8c88e52abeb7df128eaf41ffed04b6f",
      "status": "FROZEN_MACHINE_VERIFIED"
    },
    {
      "artifact_id": "SELECTIVE_REBUILD",
      "bytes": 5669,
      "final_checker_role": "EVIDENCE_OWNER",
      "kind": "JSON",
      "path": "cases/n31/evaluations/selective_rebuild_v1.json",
      "release_channels": [
        "CODE_REPOSITORY"
      ],
      "responsible_role": "TECHNICAL_OWNER",
      "sha256": "5d6b06f6fac263cfdad71e4aea687fb1ad1501e904e4169e0d4ad6ae396c568c",
      "status": "FROZEN_MACHINE_VERIFIED"
    },
    {
      "artifact_id": "AGENT_TOOL_TRACE",
      "bytes": 20750,
      "final_checker_role": "EVIDENCE_OWNER",
      "kind": "JSON",
      "path": "cases/n31/evaluations/agent_tool_trace_v1.json",
      "release_channels": [
        "CODE_REPOSITORY",
        "DEMO_RUNTIME"
      ],
      "responsible_role": "TECHNICAL_OWNER",
      "sha256": "739adef1d1e5e14c818433e87ec416cda80b562fc2eba70512e2c0aa254468a5",
      "status": "FROZEN_MACHINE_VERIFIED"
    },
    {
      "artifact_id": "RUNTIME_BENCHMARK",
      "bytes": 6656,
      "final_checker_role": "FINAL_REVIEWER",
      "kind": "JSON",
      "path": "output/evaluation/runtime_benchmark_dgx.json",
      "release_channels": [
        "CODE_REPOSITORY",
        "SUBMISSION_ATTACHMENT"
      ],
      "responsible_role": "TECHNICAL_OWNER",
      "sha256": "1e0cded9d7a59b37387ca4d64668ed8cf10603042c6876362bb5a877b8bfbde7",
      "status": "FROZEN_MACHINE_VERIFIED"
    },
    {
      "artifact_id": "POSTER",
      "bytes": 130442,
      "final_checker_role": "FINAL_REVIEWER",
      "kind": "PDF",
      "path": "output/pdf/n31_a4_training_poster.pdf",
      "release_channels": [
        "SUBMISSION_ATTACHMENT",
        "DEMO_RUNTIME"
      ],
      "responsible_role": "CONTENT_OWNER",
      "sha256": "d87dd874dc332d8057f0a1106b5b42085f6127f87ddeaa8f4b8a79eee08a8fba",
      "status": "FROZEN_MACHINE_VERIFIED"
    },
    {
      "artifact_id": "TRAINING_VIDEO",
      "bytes": 35194451,
      "final_checker_role": "FINAL_REVIEWER",
      "kind": "MP4",
      "path": "output/video/n31_training_video_v1.mp4",
      "release_channels": [
        "SUBMISSION_ATTACHMENT",
        "DEMO_RUNTIME"
      ],
      "responsible_role": "CONTENT_OWNER",
      "sha256": "61ec74826befc89889a6025a9acdb217adbd32af589a9c1f4bb4be1958ff695f",
      "status": "FROZEN_MACHINE_VERIFIED"
    },
    {
      "artifact_id": "TRAINING_VIDEO_MANIFEST",
      "bytes": 3677,
      "final_checker_role": "EVIDENCE_OWNER",
      "kind": "JSON",
      "path": "output/video/n31_training_video_manifest_v1.json",
      "release_channels": [
        "CODE_REPOSITORY"
      ],
      "responsible_role": "TECHNICAL_OWNER",
      "sha256": "457dc6d3c4baecde0643d75bf3e3b62f7cc9b2b2787100a44aeaf653e8632a3a",
      "status": "FROZEN_MACHINE_VERIFIED"
    },
    {
      "artifact_id": "TRAINING_VIDEO_EVIDENCE",
      "bytes": 20726,
      "final_checker_role": "FINAL_REVIEWER",
      "kind": "JSON",
      "path": "output/video/n31_training_video_evidence_pack_v1.json",
      "release_channels": [
        "CODE_REPOSITORY"
      ],
      "responsible_role": "EVIDENCE_OWNER",
      "sha256": "c0e826a98f650282f908a182e4620ce440bcc9017bc467d6310d711bb9895f52",
      "status": "FROZEN_MACHINE_VERIFIED"
    },
    {
      "artifact_id": "PITCH_DECK",
      "bytes": 1462651,
      "final_checker_role": "FINAL_REVIEWER",
      "kind": "PPTX",
      "path": "output/presentation/SkillForge_三分钟路演_v1.pptx",
      "release_channels": [
        "SUBMISSION_ATTACHMENT",
        "DEMO_RUNTIME"
      ],
      "responsible_role": "DEMO_OPERATOR",
      "sha256": "9878027fde7cf3714af577363a4404f8356328316c85eb9272aa2c3d70b31481",
      "status": "FROZEN_MACHINE_VERIFIED"
    }
  ],
  "branch_policy": {
    "freeze_requires_clean_worktree": true,
    "local_commit_required": true,
    "protected_branch": "main",
    "push_allowed": true,
    "regenerate_on_artifact_change": true,
    "remote_configuration_allowed": true,
    "review_required_for_p0_changes": true
  },
  "case_id": "n31_media_change",
  "data_policy": {
    "contains_absolute_paths": false,
    "contains_artifact_content": false,
    "contains_credentials": false,
    "contains_personal_data": false,
    "contains_public_urls": false
  },
  "generated_at": "2026-07-20T04:45:41.627662+00:00",
  "human_gates": [
    {
      "blocking_for_submission": true,
      "gate_id": "TRAINING_VIDEO_FULL_WATCH",
      "status": "PENDING"
    },
    {
      "blocking_for_submission": true,
      "gate_id": "FINAL_STAGE_REHEARSAL",
      "status": "PENDING"
    },
    {
      "blocking_for_submission": true,
      "gate_id": "FINAL_RECORDING_REVIEW",
      "status": "PENDING"
    },
    {
      "blocking_for_submission": true,
      "gate_id": "TEAM_ELIGIBILITY_CONFIRMED",
      "status": "PENDING"
    },
    {
      "blocking_for_submission": true,
      "gate_id": "OFFICIAL_RULES_VERIFIED",
      "status": "PENDING"
    }
  ],
  "identity_assignment": {
    "contains_personal_data": false,
    "mapping_storage": "PRIVATE_SUBMISSION_STATE",
    "status": "PENDING_TEAM_ROSTER"
  },
  "publication_targets": [
    {
      "final_checker_role": "FINAL_REVIEWER",
      "owner_role": "SUBMISSION_OWNER",
      "public_url": null,
      "status": "PENDING_SUBMISSION",
      "target_id": "PROJECT_PAGE"
    },
    {
      "final_checker_role": "FINAL_REVIEWER",
      "owner_role": "TECHNICAL_OWNER",
      "public_url": null,
      "status": "PENDING_SUBMISSION",
      "target_id": "CODE_REPOSITORY"
    },